{
 "part": {
  "firmware": {
   "error_gain": 0.166,
   "max_pwm": 1.0,
   "default_max_velocity": null
  },
  "id": "waveshare_st3025",
  "manufacturer": "Waveshare",
  "model": "ST3025",
  "variant": "12 V",
  "nominal_vin": 12.0,
  "control": "voltage_p_firmware",
  "bam_actuator": "waveshare_st3025"
 },
 "sources": [
  {
   "name": "duck_mini_pro_headless release st3025-bam-data-v1",
   "url": "https://github.com/i1Cps/duck_mini_pro_headless/releases/tag/st3025-bam-data-v1",
   "license": "not stated; see source",
   "unit": "waveshare_st3025",
   "lab": "i1Cps (GitHub)",
   "n_logs": 135,
   "bench": "single pendulum (tip mass on an arm), 6 s logs"
  }
 ],
 "conditions": {
  "kp": [
   4.0,
   8.0,
   16.0,
   32.0
  ],
  "vin": [
   11.8,
   12.2
  ],
  "load_inertia": [
   0.0004765,
   0.04738
  ],
  "gravity_torque_max": [
   0.042,
   2.258
  ],
  "temperature_c": [
   39.0,
   47.0
  ],
  "trajectories": [
   "lift_and_drop",
   "nothing",
   "sin_sin",
   "sin_time_square",
   "up_and_down"
  ]
 },
 "identifications": {
  "m1": {
   "params": {
    "kt": 1.4201511482598972,
    "error_gain_ratio": 1.2580613210149652,
    "R": 3.423149977210154,
    "armature": 0.003966008912316493,
    "q_offset": 0.00015495383029480447,
    "command_delay": 0.019377907686318047,
    "friction_base": 0.051288809674761064,
    "friction_viscous": 0.023346940820916044,
    "model": "m1"
   },
   "fitter": "CMA-ES, 2001 evaluations",
   "fit_on": "all",
   "bam_commit": "e9a619d"
  },
  "m6": {
   "params": {
    "kt": 1.4561074210119853,
    "error_gain_ratio": 1.3012809809175585,
    "R": 3.054111207250157,
    "armature": 0.004266699055002425,
    "q_offset": -0.003733694216750974,
    "command_delay": 0.018160898420451488,
    "friction_base": 0.04404970140568071,
    "friction_stribeck": 0.005677836650468369,
    "load_friction_motor": 0.1451251991711429,
    "load_friction_external": 0.017232387898920863,
    "load_friction_motor_stribeck": 0.18853974240241927,
    "load_friction_external_stribeck": 0.020645138002337735,
    "load_friction_motor_quad": 0.002192227160922735,
    "load_friction_external_quad": 0.00027437716321198133,
    "dtheta_stribeck": 0.5438901533071091,
    "alpha": 7.692304844969574,
    "friction_viscous": 0.024310262862638772,
    "model": "m6"
   },
   "fitter": "CMA-ES, 4009 evaluations",
   "fit_on": "all",
   "bam_commit": "e9a619d"
  }
 },
 "error": {
  "b0_deg": 10.797,
  "m1_deg": 1.354,
  "m6_deg": 1.11,
  "basis": "random 80/20 split, 27 held-out logs, open-loop position MAE",
  "by_condition": {
   "m1": {
    "kp": {
     "16": 0.989,
     "32": 1.378,
     "4": 1.288,
     "8": 1.146
    },
    "load": {
     "0.0kg": 0.984,
     "0.5kg": 1.267,
     "1.1kg": 1.469
    },
    "trajectory": {
     "lift_and_drop": 2.317,
     "nothing": 0.099,
     "sin_sin": 1.089,
     "sin_time_square": 1.417,
     "up_and_down": 1.047
    },
    "phase": {
     "torque_on": 1.125,
     "torque_off": 1.331
    }
   },
   "m6": {
    "kp": {
     "16": 0.841,
     "32": 1.308,
     "4": 0.833,
     "8": 0.805
    },
    "load": {
     "0.0kg": 0.834,
     "0.5kg": 1.023,
     "1.1kg": 1.001
    },
    "trajectory": {
     "lift_and_drop": 1.86,
     "nothing": 0.097,
     "sin_sin": 0.73,
     "sin_time_square": 1.567,
     "up_and_down": 0.413
    },
    "phase": {
     "torque_on": 0.865,
     "torque_off": 1.071
    }
   }
  }
 },
 "transfer": {
  "heavier_load": {
   "m1": {
    "ratio": 1.107,
    "heldout_deg": 1.626
   },
   "m6": {
    "ratio": 1.321,
    "heldout_deg": 1.323
   }
  },
  "higher_kp": {
   "m1": {
    "ratio": 1.064,
    "heldout_deg": 1.466
   },
   "m6": {
    "ratio": 1.096,
    "heldout_deg": 1.434
   }
  },
  "unseen_trajectory": {
   "m1": {
    "ratio": 6.488,
    "heldout_deg": 15.036
   },
   "m6": {
    "ratio": 7.583,
    "heldout_deg": 14.112
   }
  },
  "backdrive": {
   "m1": {
    "heldout_on_deg": 0.672,
    "heldout_off_deg": 22.262,
    "seen_on_deg": 0.597,
    "seen_off_deg": 3.183
   },
   "m6": {
    "heldout_on_deg": 0.539,
    "heldout_off_deg": 20.94,
    "seen_on_deg": 0.519,
    "seen_off_deg": 2.536
   }
  },
  "other_unit": null
 }
}